id,title,description,genres,imdb_rating,views,ismovie,media_type_name,lang_id,language_name,enhanced_text
3151,Anukunnadi Okati Ayinadi Okati,"Four women plan to go holidaying in Goa in order to have a good time. However, things take an unexpected turn when their stripper suddenly dies in their room and they need to get rid of his body.","Comedy, Thriller",3.2,599890,1,Movie,25,తెలుగు,"Anukunnadi Okati Ayinadi Okati Anukunnadi Okati Ayinadi Okati Four women plan to go holidaying in Goa in order to have a good time. However, things take an unexpected turn when their stripper suddenly dies in their room and they need to get rid of his body. Four women plan to go holidaying in Goa in order to have a good time. However, things take an unexpected turn when their stripper suddenly dies in their room and they need to get rid of his body. Comedy Thriller film with comedy, thriller elements low rated content niche independent content feature length movie film cinema movie entertainment content తెలుగు language content language 25 entertainment telugu south indian content"
3153,Cold Case,"When a skull is found in a package, ACP Sathyajith gets tasked with identifying the victim and finding the killer. Parallelly, a journalist, who gets haunted by a spirit, investigates the mystery.","Drama, Horror",6.1,1711766,1,Movie,25,తెలుగు,"Cold Case Cold Case When a skull is found in a package, ACP Sathyajith gets tasked with identifying the victim and finding the killer. Parallelly, a journalist, who gets haunted by a spirit, investigates the mystery. When a skull is found in a package, ACP Sathyajith gets tasked with identifying the victim and finding the killer. Parallelly, a journalist, who gets haunted by a spirit, investigates the mystery. elements of thriller elements of horror Drama Horror film with drama, horror elements average rated content moderately popular content feature length movie film cinema movie entertainment content తెలుగు language content language 25 entertainment telugu south indian content"
3267,Adda,"Priya asks Abhi, who works to create rifts between lovers for money, to end an affair between her sister and her boyfriend. In the process, Abhi and Priya, engaged to someone else, fall in love.","Action, Comedy",5.1,3381933,1,Movie,25,తెలుగు,"Adda Adda Priya asks Abhi, who works to create rifts between lovers for money, to end an affair between her sister and her boyfriend. In the process, Abhi and Priya, engaged to someone else, fall in love. Priya asks Abhi, who works to create rifts between lovers for money, to end an affair between her sister and her boyfriend. In the process, Abhi and Priya, engaged to someone else, fall in love. elements of romance elements of friendship Action Comedy film with action, comedy elements low rated content moderately popular content feature length movie film cinema movie entertainment content తెలుగు language content language 25 entertainment telugu south indian content"
3268,Kotha Bangaru Lokam,"Balu falls in love with his classmate Swapna, the daughter of a rich business tycoon. Trouble brews when Swapna's parents see a picture of the couple in a newspaper and stop her from studying further.","Comedy, Romance",6.8,6077640,1,Movie,25,తెలుగు,"Kotha Bangaru Lokam Kotha Bangaru Lokam Balu falls in love with his classmate Swapna, the daughter of a rich business tycoon. Trouble brews when Swapna s parents see a picture of the couple in a newspaper and stop her from studying further. Balu falls in love with his classmate Swapna, the daughter of a rich business tycoon. Trouble brews when Swapna s parents see a picture of the couple in a newspaper and stop her from studying further. romantic emotional storyline family friendly content Comedy Romance film with comedy, romance elements decent watchable content moderately popular content feature length movie film cinema movie entertainment content తెలుగు language content language 25 entertainment telugu south indian content"
3269,Iddarammayilatho,Aakansha happens to come across the love story of Sanju and Komali in a diary. Finding that the story is incomplete she goes to meet Sanju. Matters take a turn when Aakansha falls in love with Sanju.,"Action, Romance",5.8,34370918,1,Movie,25,తెలుగు,"Iddarammayilatho Iddarammayilatho Aakansha happens to come across the love story of Sanju and Komali in a diary. Finding that the story is incomplete she goes to meet Sanju. Matters take a turn when Aakansha falls in love with Sanju. Aakansha happens to come across the love story of Sanju and Komali in a diary. Finding that the story is incomplete she goes to meet Sanju. Matters take a turn when Aakansha falls in love with Sanju. elements of romance Action Romance film with action, romance elements low rated content popular well known content feature length movie film cinema movie entertainment content తెలుగు language content language 25 entertainment telugu south indian content regional blockbuster crossover potential"
3270,Bunny,"A millionaire's daughter goes against his wishes to marry her boyfriend. However, when her father finally gives them his blessing, her fiance suddenly demands her father's entire fortune in dowry.","Action, Drama",5.7,12402338,1,Movie,25,తెలుగు,"Bunny Bunny A millionaire s daughter goes against his wishes to marry her boyfriend. However, when her father finally gives them his blessing, her fiance suddenly demands her father s entire fortune in dowry. A millionaire s daughter goes against his wishes to marry her boyfriend. However, when her father finally gives them his blessing, her fiance suddenly demands her father s entire fortune in dowry. family friendly content elements of romance elements of friendship Action Drama film with action, drama elements low rated content popular well known content feature length movie film cinema movie entertainment content తెలుగు language content language 25 entertainment telugu south indian content regional blockbuster crossover potential"
3346,Chanakya,"Arjun, a highly sought-after RAW agent, is known for his skills at catching some of the most hardened criminals. However, he falls in danger when he goes after Ibrahim Qureshi, a terrorist.","Action, Thriller",5.3,762421,1,Movie,25,తెలుగు,"Chanakya Chanakya Arjun, a highly sought-after RAW agent, is known for his skills at catching some of the most hardened criminals. However, he falls in danger when he goes after Ibrahim Qureshi, a terrorist. Arjun, a highly sought-after RAW agent, is known for his skills at catching some of the most hardened criminals. However, he falls in danger when he goes after Ibrahim Qureshi, a terrorist. elements of horror Action Thriller film with action, thriller elements low rated content niche independent content feature length movie film cinema movie entertainment content తెలుగు language content language 25 entertainment telugu south indian content"
3404,100 Days of Love,"Despite their strained history as children, a columnist falls in love with his schoolmate when they meet after years. Just as he decides to win her heart, he learns that she is engaged to another man.","Comedy, Romance",6.6,5572159,1,Movie,25,తెలుగు,"100 Days of Love 100 Days of Love Despite their strained history as children, a columnist falls in love with his schoolmate when they meet after years. Just as he decides to win her heart, he learns that she is engaged to another man. Despite their strained history as children, a columnist falls in love with his schoolmate when they meet after years. Just as he decides to win her heart, he learns that she is engaged to another man. romantic emotional storyline elements of family Comedy Romance film with comedy, romance elements decent watchable content moderately popular content feature length movie film cinema movie entertainment content తెలుగు language content language 25 entertainment telugu south indian content romantic emotional story"
3437,Korameenu,"Karuna, a wealthy man, clashes with his driver Koti when they both fall in love with the same woman. Their differences soon cause disasters in their colony.","Action, Thriller",7.1,433867,1,Movie,25,తెలుగు,"Korameenu Korameenu Karuna, a wealthy man, clashes with his driver Koti when they both fall in love with the same woman. Their differences soon cause disasters in their colony. Karuna, a wealthy man, clashes with his driver Koti when they both fall in love with the same woman. Their differences soon cause disasters in their colony. elements of romance Action Thriller film with action, thriller elements good quality rated content niche independent content feature length movie film cinema movie entertainment content తెలుగు language content language 25 entertainment telugu south indian content"
3438,Paathshala,"A group of friends nearing the end of their graduation decide to visit each other's native places. On their journey, they have adventures and spend moments that lead them towards self-discovery.","Drama, Thriller",7.2,1070720,1,Movie,25,తెలుగు,"Paathshala Paathshala A group of friends nearing the end of their graduation decide to visit each other s native places. On their journey, they have adventures and spend moments that lead them towards self-discovery. A group of friends nearing the end of their graduation decide to visit each other s native places. On their journey, they have adventures and spend moments that lead them towards self-discovery. adventurous journey story elements of action elements of friendship Drama Thriller film with drama, thriller elements good quality rated content moderately popular content feature length movie film cinema movie entertainment content తెలుగు language content language 25 entertainment telugu south indian content"
4892,నువ్వొస్తానంటే నేనొద్దంటానా,"Nuvvostanante Nenoddantana : సిరి మరియు శ్రీరామ్ ఒకరినొకరు ప్రేమించుకుంటారు మరియు పెళ్లి చేసుకోవాలని ప్లాన్ చేస్తారు. అయితే, అతని తల్లి వారి సంబంధాన్ని అంగీకరించదు.","Comedy, Romance",7.8,20635933,1,Movie,25,తెలుగు,"న వ వ స త న ట  న న ద ద ట న  న వ వ స త న ట  న న ద ద ట న  Nuvvostanante Nenoddantana : స ర  మర య  శ ర ర మ  ఒకర న కర  ప ర మ  చ క  ట ర  మర య  ప ళ ల  చ స క వ లన  ప ల న  చ స త ర . అయ త , అతన  తల ల  వ ర  స బ ధ న న  అ గ కర  చద . Nuvvostanante Nenoddantana : స ర  మర య  శ ర ర మ  ఒకర న కర  ప ర మ  చ క  ట ర  మర య  ప ళ ల  చ స క వ లన  ప ల న  చ స త ర . అయ త , అతన  తల ల  వ ర  స బ ధ న న  అ గ కర  చద . Comedy Romance film with comedy, romance elements very good well received content popular well known content feature length movie film cinema movie entertainment content తెలుగు language content language 25 entertainment telugu south indian content regional blockbuster crossover potential"
4893,దూకుడు,"Dookudu : కోమా నుంచి మేల్కొన్న మాజీ ఎమ్మెల్యే శంకర్. అజయ్, అతని కొడుకు మరియు పోలీసు, తన తండ్రి శత్రువులను కూడా వేటాడేటప్పుడు అతనిని ఎలాంటి షాక్ నుండి కాపాడటానికి అతని తండ్రి ఊహించిన విధంగా ప్రతిదీ పునఃసృష్టించాడు.","Action, Comedy",7.4,26222464,1,Movie,25,తెలుగు,"ద క డ  ద క డ  Dookudu : క మ  న  చ  మ ల క న న మ జ  ఎమ మ ల య  శ కర . అజయ , అతన  క డ క  మర య  ప ల స , తన త డ ర  శత ర వ లన  క డ  వ ట డ టప ప డ  అతన న  ఎల  ట  ష క  న  డ  క ప డట న క  అతన  త డ ర  ఊహ  చ న వ ధ గ  ప రత ద  ప న స ష ట  చ డ . Dookudu : క మ  న  చ  మ ల క న న మ జ  ఎమ మ ల య  శ కర . అజయ , అతన  క డ క  మర య  ప ల స , తన త డ ర  శత ర వ లన  క డ  వ ట డ టప ప డ  అతన న  ఎల  ట  ష క  న  డ  క ప డట న క  అతన  త డ ర  ఊహ  చ న వ ధ గ  ప రత ద  ప న స ష ట  చ డ . Action Comedy film with action, comedy elements good quality rated content popular well known content feature length movie film cinema movie entertainment content తెలుగు language content language 25 entertainment telugu south indian content regional blockbuster crossover potential"
4894,ఉయ్యాల జంపాల,"Uyyala Jampala : తన బంధువు ఉమ ఎవరో చూస్తున్నారని తెలుసుకున్న సూరి, దర్యాప్తు చేయాలని నిర్ణయించుకున్నాడు మరియు ఆ వ్యక్తి మోసగాడు అని తెలుసుకుంటాడు. ఉమ అబ్బాయితో పారిపోయినప్పుడు, సూరి ఆమెను ట్రాక్ చేసి తన ప్రేమికుడిని బహిర్గతం చేయడానికి ప్రయత్నిస్తాడు.","Romance, Family",7.1,16158633,1,Movie,25,తెలుగు,"ఉయ య ల జ ప ల ఉయ య ల జ ప ల Uyyala Jampala : తన బ ధ వ  ఉమ ఎవర  చ స త న న రన  త ల స క న న స ర , దర య ప త  చ య లన  న ర ణయ  చ క న న డ  మర య  ఆ వ యక త  మ సగ డ  అన  త ల స క  ట డ . ఉమ అబ బ య త  ప ర ప య నప ప డ , స ర  ఆమ న  ట ర క  చ స  తన ప ర మ క డ న  బహ ర గత  చ యడ న క  ప రయత న స త డ . Uyyala Jampala : తన బ ధ వ  ఉమ ఎవర  చ స త న న రన  త ల స క న న స ర , దర య ప త  చ య లన  న ర ణయ  చ క న న డ  మర య  ఆ వ యక త  మ సగ డ  అన  త ల స క  ట డ . ఉమ అబ బ య త  ప ర ప య నప ప డ , స ర  ఆమ న  ట ర క  చ స  తన ప ర మ క డ న  బహ ర గత  చ యడ న క  ప రయత న స త డ . Romance Family film with romance, family elements good quality rated content popular well known content feature length movie film cinema movie entertainment content తెలుగు language content language 25 entertainment telugu south indian content regional blockbuster crossover potential"
7963,ట్రాన్స్,"Trance: విజు, ఒక మోటివేషనల్ స్పీకర్, అతను ఒక మతపరమైన కుంభకోణం యొక్క ముఖంగా నియమించబడ్డాడు, దాని కోసం అతను కఠినమైన శిక్షణ పొందుతాడు. అతని ప్రజాదరణ పెరుగుతున్న కొద్దీ, అతను చీకటి మరియు మాయ యొక్క లోతులలో మునిగిపోతాడు.","Drama, Thriller",7.3,246183,1,Movie,25,తెలుగు,"ట ర న స  ట ర న స  Trance: వ జ , ఒక మ ట వ షనల  స ప కర , అతన  ఒక మతపరమ న క  భక ణ  య క క మ ఖ గ  న యమ  చబడ డ డ , ద న  క స  అతన  కఠ నమ న శ క షణ ప  ద త డ . అతన  ప రజ దరణ ప ర గ త న న క ద ద , అతన  చ కట  మర య  మ య య క క ల త లల  మ న గ ప త డ . Trance: వ జ , ఒక మ ట వ షనల  స ప కర , అతన  ఒక మతపరమ న క  భక ణ  య క క మ ఖ గ  న యమ  చబడ డ డ , ద న  క స  అతన  కఠ నమ న శ క షణ ప  ద త డ . అతన  ప రజ దరణ ప ర గ త న న క ద ద , అతన  చ కట  మర య  మ య య క క ల త లల  మ న గ ప త డ . Drama Thriller film with drama, thriller elements good quality rated content niche independent content feature length movie film cinema movie entertainment content తెలుగు language content language 25 entertainment telugu south indian content"
7964,రచ,"Racha: బెట్టింగ్‌ల ద్వారా డబ్బు సంపాదించే నిర్లక్ష్యపు బాలుడు తన తండ్రి అనారోగ్యంతో బాధపడుతున్నప్పుడు ఇబ్బందుల్లో పడ్డాడు. నిధులను సేకరించడానికి, అతను ఒక స్త్రీని ఆకర్షించే సవాలును తీసుకుంటాడు, కానీ ఆశ్చర్యకరమైన వాస్తవం విషయాలను మారుస్తుంది.","Action, Drama",4.4,43451291,1,Movie,25,తెలుగు,"రచ రచ Racha: బ ట ట  గ  ల ద వ ర  డబ బ  స ప ద  చ  న ర లక ష యప  బ ల డ  తన త డ ర  అన ర గ య త  బ ధపడ త న నప ప డ  ఇబ బ ద ల ల  పడ డ డ . న ధ లన  స కర  చడ న క , అతన  ఒక స త ర న  ఆకర ష  చ  సవ ల న  త స క  ట డ , క న  ఆశ చర యకరమ న వ స తవ  వ షయ లన  మ ర స త  ద . Racha: బ ట ట  గ  ల ద వ ర  డబ బ  స ప ద  చ  న ర లక ష యప  బ ల డ  తన త డ ర  అన ర గ య త  బ ధపడ త న నప ప డ  ఇబ బ ద ల ల  పడ డ డ . న ధ లన  స కర  చడ న క , అతన  ఒక స త ర న  ఆకర ష  చ  సవ ల న  త స క  ట డ , క న  ఆశ చర యకరమ న వ స తవ  వ షయ లన  మ ర స త  ద . Action Drama film with action, drama elements low rated content popular well known content feature length movie film cinema movie entertainment content తెలుగు language content language 25 entertainment telugu south indian content regional blockbuster crossover potential"
8062,గమ్మత్తు,"Gammathu: హాలీవుడ్ చలనచిత్రం ""పెర్ఫ్యూమ్"" ద్వారా ప్రేరేపించబడిన తెలివైన యువకుడు బావాజీ, శాస్త్రవేత్త కావాలని కోరుకుంటాడు, అతను నేరస్థుడిగా పొరబడ్డాడు మరియు నగరంలో మహిళలపై జరుగుతున్న క్రూరమైన దాడులలో ప్రధాన నిందితుడిగా మారాడు.","Thriller, Crime, Romance",6.3,67463,1,Movie,25,తెలుగు,"గమ మత త  గమ మత త  Gammathu: హ ల వ డ  చలనచ త ర   ప ర ఫ య మ   ద వ ర  ప ర ర ప  చబడ న త ల వ న య వక డ  బ వ జ , శ స త రవ త త క వ లన  క ర క  ట డ , అతన  న రస థ డ గ  ప రబడ డ డ  మర య  నగర ల  మహ ళలప  జర గ త న న క ర రమ న ద డ లల  ప రధ న న  ద త డ గ  మ ర డ . Gammathu: హ ల వ డ  చలనచ త ర   ప ర ఫ య మ   ద వ ర  ప ర ర ప  చబడ న త ల వ న య వక డ  బ వ జ , శ స త రవ త త క వ లన  క ర క  ట డ , అతన  న రస థ డ గ  ప రబడ డ డ  మర య  నగర ల  మహ ళలప  జర గ త న న క ర రమ న ద డ లల  ప రధ న న  ద త డ గ  మ ర డ . Thriller Crime Romance film with thriller, crime, romance elements average rated content niche independent content feature length movie film cinema movie entertainment content తెలుగు language content language 25 entertainment telugu south indian content"
8063,మనం,"Manam: ఆరేళ్ల బిట్టు దురదృష్టవశాత్తూ కారు ప్రమాదంలో తల్లిదండ్రులను కోల్పోతాడు. ముప్పై సంవత్సరాల తరువాత, అతను తన చివరి తల్లిదండ్రుల యువకులను పోలి ఉండే ఇద్దరు కొలీజియన్లను కలుస్తాడు.","Comedy, Romance",8.0,5974,1,Movie,25,తెలుగు,"మన  మన  Manam: ఆర ళ ల బ ట ట  ద రద ష టవశ త త  క ర  ప రమ ద ల  తల ల ద డ ర లన  క ల ప త డ . మ ప ప  స వత సర ల తర వ త, అతన  తన చ వర  తల ల ద డ ర ల య వక లన  ప ల  ఉ డ  ఇద దర  క ల జ యన లన  కల స త డ . Manam: ఆర ళ ల బ ట ట  ద రద ష టవశ త త  క ర  ప రమ ద ల  తల ల ద డ ర లన  క ల ప త డ . మ ప ప  స వత సర ల తర వ త, అతన  తన చ వర  తల ల ద డ ర ల య వక లన  ప ల  ఉ డ  ఇద దర  క ల జ యన లన  కల స త డ . Comedy Romance film with comedy, romance elements excellent highly rated content niche independent content feature length movie film cinema movie entertainment content తెలుగు language content language 25 entertainment telugu south indian content"
8064,వదలడు,"Vadaladu: జగన్నాథన్ అనే ఫుడ్ సేఫ్టీ ఆఫీసర్ కల్తీ ఆహారాన్ని విక్రయించే అవుట్‌లెట్లను మూసివేసి శత్రువులను సంపాదిస్తాడు. అతను చనిపోయినప్పుడు, తనను హత్య చేసిన వారిపై ప్రతీకారం తీర్చుకోవడానికి అనాస్మిక అయిన తన ప్రేమికుడు జ్యోతిని కలిగి ఉంటాడు.","Action, Horror",4.7,1105770,1,Movie,25,తెలుగు,"వదలడ  వదలడ  Vadaladu: జగన న థన  అన  ఫ డ  స ఫ ట  ఆఫ సర  కల త  ఆహ ర న న  వ క రయ  చ  అవ ట  ల ట లన  మ స వ స  శత ర వ లన  స ప ద స త డ . అతన  చన ప య నప ప డ , తనన  హత య చ స న వ ర ప  ప రత క ర  త ర చ క వడ న క  అన స మ క అయ న తన ప ర మ క డ  జ య త న  కల గ  ఉ ట డ . Vadaladu: జగన న థన  అన  ఫ డ  స ఫ ట  ఆఫ సర  కల త  ఆహ ర న న  వ క రయ  చ  అవ ట  ల ట లన  మ స వ స  శత ర వ లన  స ప ద స త డ . అతన  చన ప య నప ప డ , తనన  హత య చ స న వ ర ప  ప రత క ర  త ర చ క వడ న క  అన స మ క అయ న తన ప ర మ క డ  జ య త న  కల గ  ఉ ట డ . Action Horror film with action, horror elements low rated content moderately popular content feature length movie film cinema movie entertainment content తెలుగు language content language 25 entertainment telugu south indian content"
8168,మను చరిత్ర,"Manu Charitra: అకడమిక్ జీనియస్ మను చివరికి బాగస్ ఎ థూ, కానీ అతను ప్రేమలో పడ్డాడు. అతను తన జీవితాన్ని మలుపుతిప్పడానికి మరియు పసక్‌ను ఒక హక్కుగా పొందడానికి చాలా కృషి చేస్తాడు.","Action, Romance",6.0,82530,1,Movie,25,తెలుగు,"మన  చర త ర మన  చర త ర Manu Charitra: అకడమ క  జ న యస  మన  చ వర క  బ గస  ఎ థ , క న  అతన  ప ర మల  పడ డ డ . అతన  తన జ వ త న న  మల ప త ప పడ న క  మర య  పసక  న  ఒక హక క గ  ప  దడ న క  చ ల  క ష  చ స త డ . Manu Charitra: అకడమ క  జ న యస  మన  చ వర క  బ గస  ఎ థ , క న  అతన  ప ర మల  పడ డ డ . అతన  తన జ వ త న న  మల ప త ప పడ న క  మర య  పసక  న  ఒక హక క గ  ప  దడ న క  చ ల  క ష  చ స త డ . Action Romance film with action, romance elements average rated content niche independent content feature length movie film cinema movie entertainment content తెలుగు language content language 25 entertainment telugu south indian content"
