id,title,description,genres,imdb_rating,views,ismovie,media_type_name,lang_id,language_name,enhanced_text
214,Race Gurram,Directed by Surender Reddy and produced by Nallamalupu Srinivas,"Action, Comedy",7.0,361648,1,Movie,25,తెలుగు,"Race Gurram Race Gurram Directed by Surender Reddy and produced by Nallamalupu Srinivas Directed by Surender Reddy and produced by Nallamalupu Srinivas Action Comedy film with action, comedy elements good quality rated content niche independent content feature length movie film cinema movie entertainment content తెలుగు language content language 25 entertainment telugu south indian content"
219,Adirindhi,మారన్ అనే వైద్యుడు తన సహోద్యోగి డాక్టర్ అర్జున్ జకరియా హత్య కేసులో తప్పుడు అరెస్టు చేయబడ్డాడు. వైద్య పరిశ్రమలో అవినీతిని బట్టబయలు చేయాలనే లక్ష్యంతో అసలైన అపరాధి ఒక వ్యక్తి అని అతను త్వరలోనే తెలుసుకుంటాడు.,"Action, Drama, Love Story, Thriller",8.0,902263,1,Movie,25,తెలుగు,"Adirindhi Adirindhi మ రన  అన  వ ద య డ  తన సహ ద య గ  డ క టర  అర జ న  జకర య  హత య క స ల  తప ప డ  అర స ట  చ యబడ డ డ . వ ద య పర శ రమల  అవ న త న  బట టబయల  చ య లన  లక ష య త  అసల న అపర ధ  ఒక వ యక త  అన  అతన  త వరల న  త ల స క  ట డ . మ రన  అన  వ ద య డ  తన సహ ద య గ  డ క టర  అర జ న  జకర య  హత య క స ల  తప ప డ  అర స ట  చ యబడ డ డ . వ ద య పర శ రమల  అవ న త న  బట టబయల  చ య లన  లక ష య త  అసల న అపర ధ  ఒక వ యక త  అన  అతన  త వరల న  త ల స క  ట డ . Action Drama Love Story Thriller film with action, drama, love story, thriller elements excellent highly rated content niche independent content feature length movie film cinema movie entertainment content తెలుగు language content language 25 entertainment telugu south indian content"
237,Maas (Maari),Film written and directed by Balaji Mohan,"Action, Comedy",6.0,456377,1,Movie,25,తెలుగు,"Maas  Maari  Maas  Maari  Film written and directed by Balaji Mohan Film written and directed by Balaji Mohan Action Comedy film with action, comedy elements average rated content niche independent content feature length movie film cinema movie entertainment content తెలుగు language content language 25 entertainment telugu south indian content"
245,Oopiri,"Directed by Vamshi Paidipally, and produced by PVP Cinema.","Comedy, Drama",8.0,9706011,1,Movie,25,తెలుగు,"Oopiri Oopiri Directed by Vamshi Paidipally, and produced by PVP Cinema. Directed by Vamshi Paidipally, and produced by PVP Cinema. Comedy Drama film with comedy, drama elements excellent highly rated content moderately popular content feature length movie film cinema movie entertainment content తెలుగు language content language 25 entertainment telugu south indian content"
255,Raja The Great,Directed by Anil Ravipudi and produced by Dil Raju,"Action, Comedy",6.0,325830,1,Movie,25,తెలుగు,"Raja The Great Raja The Great Directed by Anil Ravipudi and produced by Dil Raju Directed by Anil Ravipudi and produced by Dil Raju Action Comedy film with action, comedy elements average rated content niche independent content feature length movie film cinema movie entertainment content తెలుగు language content language 25 entertainment telugu south indian content"
258,Autonagar Surya,Film directed by Deva Katta,Action,6.0,1080520,1,Movie,25,తెలుగు,Autonagar Surya Autonagar Surya Film directed by Deva Katta Film directed by Deva Katta Action film with action elements average rated content moderately popular content feature length movie film cinema movie entertainment content తెలుగు language content language 25 entertainment telugu south indian content
265,The Warriorr,Film directed by N. Lingusamy,"Action, Love Story, Fantasy",5.0,262874,1,Movie,25,తెలుగు,"The Warriorr The Warriorr Film directed by N. Lingusamy Film directed by N. Lingusamy Action Love Story Fantasy film with action, love story, fantasy elements low rated content niche independent content feature length movie film cinema movie entertainment content తెలుగు language content language 25 entertainment telugu south indian content intense action sequences"
274,Saakini Daakini,Film directed by Sudheer Varma,"Action, Comedy",6.0,362250,1,Movie,25,తెలుగు,"Saakini Daakini Saakini Daakini Film directed by Sudheer Varma Film directed by Sudheer Varma Action Comedy film with action, comedy elements average rated content niche independent content feature length movie film cinema movie entertainment content తెలుగు language content language 25 entertainment telugu south indian content"
286,Rebel,Film written and directed by Raghava Lawrence,Action,5.0,236615,1,Movie,25,తెలుగు,Rebel Rebel Film written and directed by Raghava Lawrence Film written and directed by Raghava Lawrence Action film with action elements low rated content niche independent content feature length movie film cinema movie entertainment content తెలుగు language content language 25 entertainment telugu south indian content
294,Mirchi,Film written and directed by debutante Koratala Siva,"Action, Drama",7.0,321655,1,Movie,25,తెలుగు,"Mirchi Mirchi Film written and directed by debutante Koratala Siva Film written and directed by debutante Koratala Siva Action Drama film with action, drama elements good quality rated content niche independent content feature length movie film cinema movie entertainment content తెలుగు language content language 25 entertainment telugu south indian content"
312,Oh My Friend,Film written and directed by newcomer Venu Sri Ram,"Drama, Love Story, Fantasy",7.0,321649,1,Movie,25,తెలుగు,"Oh My Friend Oh My Friend Film written and directed by newcomer Venu Sri Ram Film written and directed by newcomer Venu Sri Ram Drama Love Story Fantasy film with drama, love story, fantasy elements good quality rated content niche independent content feature length movie film cinema movie entertainment content తెలుగు language content language 25 entertainment telugu south indian content"
319,Legend,Film written and directed by Boyapati Srinu,"Action, Drama",6.0,231719,1,Movie,25,తెలుగు,"Legend Legend Film written and directed by Boyapati Srinu Film written and directed by Boyapati Srinu Action Drama film with action, drama elements average rated content niche independent content feature length movie film cinema movie entertainment content తెలుగు language content language 25 entertainment telugu south indian content"
1506,Chennai vs China,Chennai vs China  Full Movie Hindi Dubbed,"Action, Drama, War",6.5,31632719,1,Movie,25,తెలుగు,"Chennai vs China Chennai vs China Chennai vs China Full Movie Hindi Dubbed Chennai vs China Full Movie Hindi Dubbed Action Drama War film with action, drama, war elements decent watchable content popular well known content feature length movie film cinema movie entertainment content తెలుగు language content language 25 entertainment telugu south indian content regional blockbuster crossover potential"
2044,Doctor,"Sivakarthikeyan, Vinay Rai, Priyanka Arul Mohan","Action, Drama, Love Story, Thriller, Crime, Romance",7.4,4033648,1,Movie,25,తెలుగు,"Doctor Doctor Sivakarthikeyan, Vinay Rai, Priyanka Arul Mohan Sivakarthikeyan, Vinay Rai, Priyanka Arul Mohan Action Drama Love Story Thriller Crime Romance film with action, drama, love story, thriller, crime, romance elements good quality rated content moderately popular content feature length movie film cinema movie entertainment content తెలుగు language content language 25 entertainment telugu south indian content"
2347,Krishna Vrinda Vihari,"Naga Shaurya, Shirley Setia & Others. Directed by Anish R Krishna. Music composed by Mahati Swara Sagar.","Comedy, Drama, Love Story",5.8,1166590,1,Movie,25,తెలుగు,"Krishna Vrinda Vihari Krishna Vrinda Vihari Naga Shaurya, Shirley Setia   Others. Directed by Anish R Krishna. Music composed by Mahati Swara Sagar. Naga Shaurya, Shirley Setia   Others. Directed by Anish R Krishna. Music composed by Mahati Swara Sagar. elements of action Comedy Drama Love Story film with comedy, drama, love story elements low rated content moderately popular content feature length movie film cinema movie entertainment content తెలుగు language content language 25 entertainment telugu south indian content"
2495,Maaran,"Mathimaaaran, an honest journalist, exposes a fraud by Pazhani, a politician. As a result, it lands his career in trouble, while also threatening his family's safety.","Action, Thriller",4.4,2090701,1,Movie,25,తెలుగు,"Maaran Maaran Mathimaaaran, an honest journalist, exposes a fraud by Pazhani, a politician. As a result, it lands his career in trouble, while also threatening his family s safety. Mathimaaaran, an honest journalist, exposes a fraud by Pazhani, a politician. As a result, it lands his career in trouble, while also threatening his family s safety. elements of drama elements of family Action Thriller film with action, thriller elements low rated content moderately popular content feature length movie film cinema movie entertainment content తెలుగు language content language 25 entertainment telugu south indian content"
2496,Ye Mantram Vesaave,"Nikhil, a youngster, plays video games and woos girls on social media. However, his life turns upside down when he tries to hit on Rags, a game developer.","Thriller, Romance",3.7,478327,1,Movie,25,తెలుగు,"Ye Mantram Vesaave Ye Mantram Vesaave Nikhil, a youngster, plays video games and woos girls on social media. However, his life turns upside down when he tries to hit on Rags, a game developer. Nikhil, a youngster, plays video games and woos girls on social media. However, his life turns upside down when he tries to hit on Rags, a game developer. elements of drama elements of coming_of_age Thriller Romance film with thriller, romance elements low rated content niche independent content feature length movie film cinema movie entertainment content తెలుగు language content language 25 entertainment telugu south indian content"
2497,Ye Maaya Chesave,"Karthik, an engineering graduate, wants to make films. He falls in love with Jessie, his neighbour, but her father opposes their relationship due to religious differences.","Drama, Romance",7.7,11089245,1,Movie,25,తెలుగు,"Ye Maaya Chesave Ye Maaya Chesave Karthik, an engineering graduate, wants to make films. He falls in love with Jessie, his neighbour, but her father opposes their relationship due to religious differences. Karthik, an engineering graduate, wants to make films. He falls in love with Jessie, his neighbour, but her father opposes their relationship due to religious differences. romantic emotional storyline elements of family Drama Romance film with drama, romance elements very good well received content popular well known content feature length movie film cinema movie entertainment content తెలుగు language content language 25 entertainment telugu south indian content regional blockbuster crossover potential"
2498,Jail,"Three childhood friends get thrown out of their village under the guise of resettlement. In addition to adjusting to the new reality, they must fight for their rights and strive hard to make a living.","Action, Crime",4.8,12268,1,Movie,25,తెలుగు,"Jail Jail Three childhood friends get thrown out of their village under the guise of resettlement. In addition to adjusting to the new reality, they must fight for their rights and strive hard to make a living. Three childhood friends get thrown out of their village under the guise of resettlement. In addition to adjusting to the new reality, they must fight for their rights and strive hard to make a living. elements of action elements of friendship Action Crime film with action, crime elements low rated content niche independent content feature length movie film cinema movie entertainment content తెలుగు language content language 25 entertainment telugu south indian content"
2499,Crazy Uncles,"Unhappy in their respective marriages, three moderately wealthy middle-aged men decide to live life to the fullest. However, their plans go awry when they try to seduce a singer.","Comedy, Drama, Romance",9.0,3184462,1,Movie,25,తెలుగు,"Crazy Uncles Crazy Uncles Unhappy in their respective marriages, three moderately wealthy middle-aged men decide to live life to the fullest. However, their plans go awry when they try to seduce a singer. Unhappy in their respective marriages, three moderately wealthy middle-aged men decide to live life to the fullest. However, their plans go awry when they try to seduce a singer. elements of drama Comedy Drama Romance film with comedy, drama, romance elements exceptional highly acclaimed masterpiece moderately popular content feature length movie film cinema movie entertainment content తెలుగు language content language 25 entertainment telugu south indian content"
2530,DJ Duvvada Jagannadham,"DJ, a rebellious man and a cook, gets trained to become an undercover officer and is assigned to take down a corrupt politician. Unexpectedly, he falls in love with the politician's daughter.","Action, Comedy",76.0,13069090,1,Movie,25,తెలుగు,"DJ Duvvada Jagannadham DJ Duvvada Jagannadham DJ, a rebellious man and a cook, gets trained to become an undercover officer and is assigned to take down a corrupt politician. Unexpectedly, he falls in love with the politician s daughter. DJ, a rebellious man and a cook, gets trained to become an undercover officer and is assigned to take down a corrupt politician. Unexpectedly, he falls in love with the politician s daughter. elements of romance elements of family Action Comedy film with action, comedy elements exceptional highly acclaimed masterpiece popular well known content feature length movie film cinema movie entertainment content తెలుగు language content language 25 entertainment telugu south indian content regional blockbuster crossover potential"
2541,Nenu Local,"Babu, an easy-going young man, falls in love with a woman. However, he learns that he has a competitor in winning the woman's father's approval and takes up a challenge to impress him.","Comedy, Romance",6.4,111723073,1,Movie,25,తెలుగు,"Nenu Local Nenu Local Babu, an easy-going young man, falls in love with a woman. However, he learns that he has a competitor in winning the woman s father s approval and takes up a challenge to impress him. Babu, an easy-going young man, falls in love with a woman. However, he learns that he has a competitor in winning the woman s father s approval and takes up a challenge to impress him. elements of romance elements of family elements of coming_of_age Comedy Romance film with comedy, romance elements average rated content blockbuster extremely popular content feature length movie film cinema movie entertainment content తెలుగు language content language 25 entertainment telugu south indian content regional blockbuster crossover potential"
2552,Shatamanam Bhavati,"An old couple living with their grandson, yearn for the love of their children, who live abroad and hardly visit them. The frustrated couple hatch a plan to make their children come home.","Drama, Romance",7.0,106190923,1,Movie,25,తెలుగు,"Shatamanam Bhavati Shatamanam Bhavati An old couple living with their grandson, yearn for the love of their children, who live abroad and hardly visit them. The frustrated couple hatch a plan to make their children come home. An old couple living with their grandson, yearn for the love of their children, who live abroad and hardly visit them. The frustrated couple hatch a plan to make their children come home. romantic emotional storyline family friendly content Drama Romance film with drama, romance elements good quality rated content blockbuster extremely popular content feature length movie film cinema movie entertainment content తెలుగు language content language 25 entertainment telugu south indian content regional blockbuster crossover potential"
2563,Sitamma Vakitlo Sirimalle Chettu,"Two brothers face ridicule due to unemployment and their family's poor financial background. Consequently, their bond with each other and their love lives are deeply affected.","Action, Comedy",7.5,2948810,1,Movie,25,తెలుగు,"Sitamma Vakitlo Sirimalle Chettu Sitamma Vakitlo Sirimalle Chettu Two brothers face ridicule due to unemployment and their family s poor financial background. Consequently, their bond with each other and their love lives are deeply affected. Two brothers face ridicule due to unemployment and their family s poor financial background. Consequently, their bond with each other and their love lives are deeply affected. elements of romance elements of drama elements of family Action Comedy film with action, comedy elements very good well received content moderately popular content feature length movie film cinema movie entertainment content తెలుగు language content language 25 entertainment telugu south indian content"
2574,Ramayya Vasthavayya,"In a small village, three evil men kill a lot of innocent people to grab their lands. A young man loses all his loved ones in the process and sets out to seek revenge.","Action, Drama",5.1,24736540,1,Movie,25,తెలుగు,"Ramayya Vasthavayya Ramayya Vasthavayya In a small village, three evil men kill a lot of innocent people to grab their lands. A young man loses all his loved ones in the process and sets out to seek revenge. In a small village, three evil men kill a lot of innocent people to grab their lands. A young man loses all his loved ones in the process and sets out to seek revenge. elements of romance elements of coming_of_age Action Drama film with action, drama elements low rated content popular well known content feature length movie film cinema movie entertainment content తెలుగు language content language 25 entertainment telugu south indian content regional blockbuster crossover potential"
2633,Raja Rani,"John and Regina, who dislike each other, are forced to get married and lead troubled lives. However, things take a turn when the couple suffers a sudden tragedy.","Comedy, Romance",7.6,41882669,1,Movie,25,తెలుగు,"Raja Rani Raja Rani John and Regina, who dislike each other, are forced to get married and lead troubled lives. However, things take a turn when the couple suffers a sudden tragedy. John and Regina, who dislike each other, are forced to get married and lead troubled lives. However, things take a turn when the couple suffers a sudden tragedy. elements of romance Comedy Romance film with comedy, romance elements very good well received content popular well known content feature length movie film cinema movie entertainment content తెలుగు language content language 25 entertainment telugu south indian content regional blockbuster crossover potential"
2716,100% Love,"Balu and Mahalakshmi fall for each other but go their separate ways due to ego clashes. Years later, when their grandmother falls ill, they are forced to confront each other.","Comedy, Romance",7.0,34784869,1,Movie,25,తెలుగు,"100  Love 100  Love Balu and Mahalakshmi fall for each other but go their separate ways due to ego clashes. Years later, when their grandmother falls ill, they are forced to confront each other. Balu and Mahalakshmi fall for each other but go their separate ways due to ego clashes. Years later, when their grandmother falls ill, they are forced to confront each other. elements of family Comedy Romance film with comedy, romance elements good quality rated content popular well known content feature length movie film cinema movie entertainment content తెలుగు language content language 25 entertainment telugu south indian content romantic emotional story regional blockbuster crossover potential"
2973,Paper Boy,"Ravi is a paper boy who is in a relationship with a rich girl, Dharani. However, the social inequality between them poses a threat to the future they plan on having together.","Action, Romance",6.3,16252563,1,Movie,25,తెలుగు,"Paper Boy Paper Boy Ravi is a paper boy who is in a relationship with a rich girl, Dharani. However, the social inequality between them poses a threat to the future they plan on having together. Ravi is a paper boy who is in a relationship with a rich girl, Dharani. However, the social inequality between them poses a threat to the future they plan on having together. elements of romance Action Romance film with action, romance elements average rated content popular well known content feature length movie film cinema movie entertainment content తెలుగు language content language 25 entertainment telugu south indian content regional blockbuster crossover potential"
2980,Govindudu Andarivadele,London-based Abhiram decides to reunite his estranged father with his family in India. He visits his ancestral village and makes efforts to connect with the family while keeping his identity hidden.,"Action, Romance",5.7,50933803,1,Movie,25,తెలుగు,"Govindudu Andarivadele Govindudu Andarivadele London-based Abhiram decides to reunite his estranged father with his family in India. He visits his ancestral village and makes efforts to connect with the family while keeping his identity hidden. London-based Abhiram decides to reunite his estranged father with his family in India. He visits his ancestral village and makes efforts to connect with the family while keeping his identity hidden. family friendly content elements of drama Action Romance film with action, romance elements low rated content very popular mainstream hit feature length movie film cinema movie entertainment content తెలుగు language content language 25 entertainment telugu south indian content regional blockbuster crossover potential"
3013,Geethanjali,"Prakash, who is diagnosed with terminal cancer, and Geethanjali, an equally ill patient, fall in love with each other. However, when she learns about his illness, she decides to move out of his life.","Drama, Romance",8.3,911651,1,Movie,25,తెలుగు,"Geethanjali Geethanjali Prakash, who is diagnosed with terminal cancer, and Geethanjali, an equally ill patient, fall in love with each other. However, when she learns about his illness, she decides to move out of his life. Prakash, who is diagnosed with terminal cancer, and Geethanjali, an equally ill patient, fall in love with each other. However, when she learns about his illness, she decides to move out of his life. elements of romance elements of drama Drama Romance film with drama, romance elements excellent highly rated content niche independent content feature length movie film cinema movie entertainment content తెలుగు language content language 25 entertainment telugu south indian content"
3143,Lovers Day,"With the help of his friends, Roshan starts dating Priya. However, things take a turn when he ends up falling in love with Gadha, his best friend.","Comedy, Romance",4.6,8157169,1,Movie,25,తెలుగు,"Lovers Day Lovers Day With the help of his friends, Roshan starts dating Priya. However, things take a turn when he ends up falling in love with Gadha, his best friend. With the help of his friends, Roshan starts dating Priya. However, things take a turn when he ends up falling in love with Gadha, his best friend. elements of romance elements of friendship Comedy Romance film with comedy, romance elements low rated content moderately popular content feature length movie film cinema movie entertainment content తెలుగు language content language 25 entertainment telugu south indian content romantic emotional story"
3144,Ninnu Kori,"Pallavi invites Uma, her ex-boyfriend, to stay at her home with her husband to convince him that she is happy in her marriage. Uma tries to create a rift between them, hoping to win Pallavi back.","Comedy, Romance",7.5,2997068,1,Movie,25,తెలుగు,"Ninnu Kori Ninnu Kori Pallavi invites Uma, her ex-boyfriend, to stay at her home with her husband to convince him that she is happy in her marriage. Uma tries to create a rift between them, hoping to win Pallavi back. Pallavi invites Uma, her ex-boyfriend, to stay at her home with her husband to convince him that she is happy in her marriage. Uma tries to create a rift between them, hoping to win Pallavi back. elements of friendship Comedy Romance film with comedy, romance elements very good well received content moderately popular content feature length movie film cinema movie entertainment content తెలుగు language content language 25 entertainment telugu south indian content"
