id,title,description,genres,imdb_rating,views,ismovie,media_type_name,lang_id,language_name,enhanced_text
4525,La red bajo 1,"Los jóvenes investigan a una misteriosa figura de Internet, el Getter, en una cadena de favores con dilemas morales. Dirigido por Irene, el grupo se enfrenta a solicitudes ilegales mientras desentraña la identidad del Getter"".","Drama, Mystery",7.2,10523340,0,Series/TV Show,4,Español,"La red bajo 1 La red bajo 1 Los jóvenes investigan a una misteriosa figura de Internet, el Getter, en una cadena de favores con dilemas morales. Dirigido por Irene, el grupo se enfrenta a solicitudes ilegales mientras desentraña la identidad del Getter . Los jóvenes investigan a una misteriosa figura de Internet, el Getter, en una cadena de favores con dilemas morales. Dirigido por Irene, el grupo se enfrenta a solicitudes ilegales mientras desentraña la identidad del Getter . Drama Mystery film with drama, mystery elements good quality rated content popular well known content television series episodic show series entertainment content Español language content language 4 entertainment spanish latino hispanic content regional blockbuster crossover potential"
4526,La red bajo 2,"La cadena de favores sigue funcionando, pero ahora con un nuevo Conseguidor al mando: Irene. Ninguno de sus amigos lo sabe, aunque Joel sospecha que sucede algo. Mientras tanto, dos nuevos miembros caen en las redes de C: Anaís, una cantante que oculta un secreto, y Gabriel, un viejo “amigo” de Kiu. No te pierdas el desenlace de de Bajo la red.","Drama, Mystery",7.2,3432876,0,Series/TV Show,4,Español,"La red bajo 2 La red bajo 2 La cadena de favores sigue funcionando, pero ahora con un nuevo Conseguidor al mando: Irene. Ninguno de sus amigos lo sabe, aunque Joel sospecha que sucede algo. Mientras tanto, dos nuevos miembros caen en las redes de C: Anaís, una cantante que oculta un secreto, y Gabriel, un viejo  amigo  de Kiu. No te pierdas el desenlace de de Bajo la red. La cadena de favores sigue funcionando, pero ahora con un nuevo Conseguidor al mando: Irene. Ninguno de sus amigos lo sabe, aunque Joel sospecha que sucede algo. Mientras tanto, dos nuevos miembros caen en las redes de C: Anaís, una cantante que oculta un secreto, y Gabriel, un viejo  amigo  de Kiu. No te pierdas el desenlace de de Bajo la red. Drama Mystery film with drama, mystery elements good quality rated content moderately popular content television series episodic show series entertainment content Español language content language 4 entertainment spanish latino hispanic content"
4528,Dorien,"Dorien es una serie de televisión web española de suspenso psicológico y terror creada por Kiko y Javier Prada y protagonizada por Carolina Bang, Daniel Muriel, Macarena Gómez y Dafne Fernández. Se estrenó de 2017 a 2018 en playz de RTVE.",Horror,5.7,9461579,0,Series/TV Show,4,Español,"Dorien Dorien Dorien es una serie de televisión web española de suspenso psicológico y terror creada por Kiko y Javier Prada y protagonizada por Carolina Bang, Daniel Muriel, Macarena Gómez y Dafne Fernández. Se estrenó de 2017 a 2018 en playz de RTVE. Dorien es una serie de televisión web española de suspenso psicológico y terror creada por Kiko y Javier Prada y protagonizada por Carolina Bang, Daniel Muriel, Macarena Gómez y Dafne Fernández. Se estrenó de 2017 a 2018 en playz de RTVE. elements of horror Horror film with horror elements low rated content moderately popular content television series episodic show series entertainment content Español language content language 4 entertainment spanish latino hispanic content"
4529,Boca Norte,"Boca Norte is a Spanish drama streaming television series created by Eva Mor for Playz. Produced by RTVE in collaboration with Lavinia Audiovisual and directed by Dani de la Orden and Elena Trapé, it stars Begoña Vargas, David Solans, Marina Castro, Guillermo Lasheras, Jasmine Roldán, Júlia Creus and Guillermo Campra.",Drama,6.0,3636655,0,Series/TV Show,4,Español,"Boca Norte Boca Norte Boca Norte is a Spanish drama streaming television series created by Eva Mor for Playz. Produced by RTVE in collaboration with Lavinia Audiovisual and directed by Dani de la Orden and Elena Trapé, it stars Begoña Vargas, David Solans, Marina Castro, Guillermo Lasheras, Jasmine Roldán, Júlia Creus and Guillermo Campra. Boca Norte is a Spanish drama streaming television series created by Eva Mor for Playz. Produced by RTVE in collaboration with Lavinia Audiovisual and directed by Dani de la Orden and Elena Trapé, it stars Begoña Vargas, David Solans, Marina Castro, Guillermo Lasheras, Jasmine Roldán, Júlia Creus and Guillermo Campra. elements of drama Drama film with drama elements average rated content moderately popular content television series episodic show series entertainment content Español language content language 4 entertainment spanish latino hispanic content"
5277,Campamento Desventura S1,Campamento Desventura es una serie web mexicana producida por Odd Nation Cartoons fuertemente inspirada en Total Drama.,Reality,8.1,343063,0,Series/TV Show,4,Español,Campamento Desventura S1 Campamento Desventura S1 Campamento Desventura es una serie web mexicana producida por Odd Nation Cartoons fuertemente inspirada en Total Drama. Campamento Desventura es una serie web mexicana producida por Odd Nation Cartoons fuertemente inspirada en Total Drama. elements of drama Reality film with reality elements excellent highly rated content niche independent content television series episodic show series entertainment content Español language content language 4 entertainment spanish latino hispanic content
5279,Ser o no ser,"La historia de Joel, un adolescente transgénero de 16 años que sueña con convertirse en un gran artista, mientras enfrenta los desafíos emocionales de su nueva transición.",Drama,7.6,1209381,0,Series/TV Show,4,Español,"Ser o no ser Ser o no ser La historia de Joel, un adolescente transgénero de 16 años que sueña con convertirse en un gran artista, mientras enfrenta los desafíos emocionales de su nueva transición. La historia de Joel, un adolescente transgénero de 16 años que sueña con convertirse en un gran artista, mientras enfrenta los desafíos emocionales de su nueva transición. elements of coming_of_age Drama film with drama elements very good well received content moderately popular content television series episodic show series entertainment content Español language content language 4 entertainment spanish latino hispanic content"
5281,Yrreal,Yrreal es una serie de televisión española de acción y suspenso creada por Alberto Utrera y Paula Sánchez para Playz y protagonizada por Angy Fernández y Veki Velilla. Se estrenó el 17 de noviembre de 2021. La serie combina imágenes de acción en vivo con animación 2D.,Thriller,7.9,1253665,0,Series/TV Show,4,Español,Yrreal Yrreal Yrreal es una serie de televisión española de acción y suspenso creada por Alberto Utrera y Paula Sánchez para Playz y protagonizada por Angy Fernández y Veki Velilla. Se estrenó el 17 de noviembre de 2021. La serie combina imágenes de acción en vivo con animación 2D. Yrreal es una serie de televisión española de acción y suspenso creada por Alberto Utrera y Paula Sánchez para Playz y protagonizada por Angy Fernández y Veki Velilla. Se estrenó el 17 de noviembre de 2021. La serie combina imágenes de acción en vivo con animación 2D. Thriller film with thriller elements very good well received content moderately popular content television series episodic show series entertainment content Español language content language 4 entertainment spanish latino hispanic content
5282,Chicos de Barrio,"La suerte se abrió camino en las vidas de los hermanos elegidos en Tozluyaka, provocando un viaje de esperanza a través de encuentros con la crueldad, la injusticia y el amor. Su historia se entrelazó con la de todos",Drama,5.7,74003,0,Series/TV Show,4,Español,"Chicos de Barrio Chicos de Barrio La suerte se abrió camino en las vidas de los hermanos elegidos en Tozluyaka, provocando un viaje de esperanza a través de encuentros con la crueldad, la injusticia y el amor. Su historia se entrelazó con la de todos La suerte se abrió camino en las vidas de los hermanos elegidos en Tozluyaka, provocando un viaje de esperanza a través de encuentros con la crueldad, la injusticia y el amor. Su historia se entrelazó con la de todos Drama film with drama elements low rated content niche independent content television series episodic show series entertainment content Español language content language 4 entertainment spanish latino hispanic content"
5283,Pájaro soñador,"Sanem, un aspirante a escritor, se ve obligado a encontrar un trabajo adecuado o casarse. Para escapar de sus padres y de su matrimonio, acepta un trabajo de publicidad, pero pronto se enamora de su jefe.",Romance,7.4,6861818,0,Series/TV Show,4,Español,"Pájaro soñador Pájaro soñador Sanem, un aspirante a escritor, se ve obligado a encontrar un trabajo adecuado o casarse. Para escapar de sus padres y de su matrimonio, acepta un trabajo de publicidad, pero pronto se enamora de su jefe. Sanem, un aspirante a escritor, se ve obligado a encontrar un trabajo adecuado o casarse. Para escapar de sus padres y de su matrimonio, acepta un trabajo de publicidad, pero pronto se enamora de su jefe. Romance film with romance elements good quality rated content moderately popular content television series episodic show series entertainment content Español language content language 4 entertainment spanish latino hispanic content"
5284,In-hibidos,"Descubre la historia de 'Inhibidos', cinco adolescentes que van a pasar un fin de semana a la casa de uno de ellos. Parece un plan genial pero todo se complica cuando aparecen dos individuos en los alrededores.",Thriller,5.6,2661638,0,Series/TV Show,4,Español,"In-hibidos In-hibidos Descubre la historia de  Inhibidos , cinco adolescentes que van a pasar un fin de semana a la casa de uno de ellos. Parece un plan genial pero todo se complica cuando aparecen dos individuos en los alrededores. Descubre la historia de  Inhibidos , cinco adolescentes que van a pasar un fin de semana a la casa de uno de ellos. Parece un plan genial pero todo se complica cuando aparecen dos individuos en los alrededores. elements of coming_of_age Thriller film with thriller elements low rated content moderately popular content television series episodic show series entertainment content Español language content language 4 entertainment spanish latino hispanic content"
5315,Si fueras tú,"Alba es una joven de 17 años que se muda con su tío Miguel a una urbanización en busca de una nuevavida. Los padres de Alba se han trasladado a Nueva Zelanda por trabajo, pero ella tiene que terminar el curso en España.",Thriller,5.5,35909971,0,Series/TV Show,4,Español,"Si fueras tú Si fueras tú Alba es una joven de 17 años que se muda con su tío Miguel a una urbanización en busca de una nuevavida. Los padres de Alba se han trasladado a Nueva Zelanda por trabajo, pero ella tiene que terminar el curso en España. Alba es una joven de 17 años que se muda con su tío Miguel a una urbanización en busca de una nuevavida. Los padres de Alba se han trasladado a Nueva Zelanda por trabajo, pero ella tiene que terminar el curso en España. Thriller film with thriller elements low rated content popular well known content television series episodic show series entertainment content Español language content language 4 entertainment spanish latino hispanic content regional blockbuster crossover potential"
5316,Antes de perder,"Antes de perder es la historia de Jana y Diana, dos mujeres de treinta y tantos años que son tan diferentes en todo que, en condiciones normales, no hubieran cruzado ni un par de palabras. Pero",Adventure,6.3,1362026,0,Series/TV Show,4,Español,"Antes de perder Antes de perder Antes de perder es la historia de Jana y Diana, dos mujeres de treinta y tantos años que son tan diferentes en todo que, en condiciones normales, no hubieran cruzado ni un par de palabras. Pero Antes de perder es la historia de Jana y Diana, dos mujeres de treinta y tantos años que son tan diferentes en todo que, en condiciones normales, no hubieran cruzado ni un par de palabras. Pero elements of family Adventure film with adventure elements average rated content moderately popular content television series episodic show series entertainment content Español language content language 4 entertainment spanish latino hispanic content"
5322,Cupido,"Cupido, la película"" narra la historia de cinco jóvenes que descubren que la peculiar familia de Edrian son en realidad seres mitológicos, los ""cupidos"". Lo que comienza como una experiencia mágica se convierte en un thriller con toques de comedia romántica.",Fantasy,7.5,13867320,0,Series/TV Show,4,Español,"Cupido Cupido Cupido, la película  narra la historia de cinco jóvenes que descubren que la peculiar familia de Edrian son en realidad seres mitológicos, los  cupidos . Lo que comienza como una experiencia mágica se convierte en un thriller con toques de comedia romántica. Cupido, la película  narra la historia de cinco jóvenes que descubren que la peculiar familia de Edrian son en realidad seres mitológicos, los  cupidos . Lo que comienza como una experiencia mágica se convierte en un thriller con toques de comedia romántica. elements of thriller elements of family Fantasy film with fantasy elements very good well received content popular well known content television series episodic show series entertainment content Español language content language 4 entertainment spanish latino hispanic content regional blockbuster crossover potential"
5390,Tie the Not,Tie The Not es una historia de aceptación y despertar sexual. Te enseñará que el amor verdadero es como lo definimos. Que nunca es demasiado tarde para enamorarse y que vale la pena luchar por el amor verdadero.,Drama,7.4,122939,0,Series/TV Show,4,Español,Tie the Not Tie the Not Tie The Not es una historia de aceptación y despertar sexual. Te enseñará que el amor verdadero es como lo definimos. Que nunca es demasiado tarde para enamorarse y que vale la pena luchar por el amor verdadero. Tie The Not es una historia de aceptación y despertar sexual. Te enseñará que el amor verdadero es como lo definimos. Que nunca es demasiado tarde para enamorarse y que vale la pena luchar por el amor verdadero. Drama film with drama elements good quality rated content niche independent content television series episodic show series entertainment content Español language content language 4 entertainment spanish latino hispanic content
5391,Destinado a Encontrarte,"Jin Rongrong, la gerente general solteroa del Grupo Jinchao, conoce a Gu Congbei, un joven valiente en rectitud. Con motivo de una cita a ciegas, se entera accidentalmente de que Gu Congbei es el tercer hijo no deseado del Grupo Gu.",Romance,7.0,2249505,0,Series/TV Show,4,Español,"Destinado a Encontrarte Destinado a Encontrarte Jin Rongrong, la gerente general solteroa del Grupo Jinchao, conoce a Gu Congbei, un joven valiente en rectitud. Con motivo de una cita a ciegas, se entera accidentalmente de que Gu Congbei es el tercer hijo no deseado del Grupo Gu. Jin Rongrong, la gerente general solteroa del Grupo Jinchao, conoce a Gu Congbei, un joven valiente en rectitud. Con motivo de una cita a ciegas, se entera accidentalmente de que Gu Congbei es el tercer hijo no deseado del Grupo Gu. Romance film with romance elements good quality rated content moderately popular content television series episodic show series entertainment content Español language content language 4 entertainment spanish latino hispanic content"
5392,La cámara de Gesell,"Episode 1, ‘La cámara de Gesell’, un nuevo formato presentado por la psicóloga María Esclapez que aborda, con naturalidad, cercanía y positividad, diferentes cuestiones relacionadas con la salud mental de los jóvenes",Drama,6.0,79433,0,Series/TV Show,4,Español,"La cámara de Gesell La cámara de Gesell Episode 1,  La cámara de Gesell , un nuevo formato presentado por la psicóloga María Esclapez que aborda, con naturalidad, cercanía y positividad, diferentes cuestiones relacionadas con la salud mental de los jóvenes Episode 1,  La cámara de Gesell , un nuevo formato presentado por la psicóloga María Esclapez que aborda, con naturalidad, cercanía y positividad, diferentes cuestiones relacionadas con la salud mental de los jóvenes Drama film with drama elements average rated content niche independent content television series episodic show series entertainment content Español language content language 4 entertainment spanish latino hispanic content"
5397,Área 34 S1,"Episode 1, Un grupo de nueve influencers de primer nivel es secuestrado para participar en un misterioso proyecto del que nadie sabe nada. Esta es la base de ‘Área 34’, el nuevo game show de Playz que aborda la problemática del cambio climático.",Drama,7.0,196484,0,Series/TV Show,4,Español,"Área 34 S1 Área 34 S1 Episode 1, Un grupo de nueve influencers de primer nivel es secuestrado para participar en un misterioso proyecto del que nadie sabe nada. Esta es la base de  Área 34 , el nuevo game show de Playz que aborda la problemática del cambio climático. Episode 1, Un grupo de nueve influencers de primer nivel es secuestrado para participar en un misterioso proyecto del que nadie sabe nada. Esta es la base de  Área 34 , el nuevo game show de Playz que aborda la problemática del cambio climático. Drama film with drama elements good quality rated content niche independent content television series episodic show series entertainment content Español language content language 4 entertainment spanish latino hispanic content"
5403,"Bnet, el campeón tranquilo","Episode 1 : Bnet hace un repaso por algunas de sus batallas más relevantes. Descubre cómo vivió los enfrentamientos, sus victorias y, lo más importante, qué experiencia se llevó a casa tras las competiciones.",Drama,6.0,558148,0,Series/TV Show,4,Español,"Bnet, el campeón tranquilo Bnet, el campeón tranquilo Episode 1 : Bnet hace un repaso por algunas de sus batallas más relevantes. Descubre cómo vivió los enfrentamientos, sus victorias y, lo más importante, qué experiencia se llevó a casa tras las competiciones. Episode 1 : Bnet hace un repaso por algunas de sus batallas más relevantes. Descubre cómo vivió los enfrentamientos, sus victorias y, lo más importante, qué experiencia se llevó a casa tras las competiciones. Drama film with drama elements average rated content niche independent content television series episodic show series entertainment content Español language content language 4 entertainment spanish latino hispanic content"
5426,Batallas legendarias,"Chuty, Bnet, Skone, Blon, Gazir, Tirpa, Mister Ego y Errecé cuentan, como nunca lo habían hecho, los entresijos de los enfrentamientos más emblemáticos de FMS España.",Drama,7.0,7401,0,Series/TV Show,4,Español,"Batallas legendarias Batallas legendarias Chuty, Bnet, Skone, Blon, Gazir, Tirpa, Mister Ego y Errecé cuentan, como nunca lo habían hecho, los entresijos de los enfrentamientos más emblemáticos de FMS España. Chuty, Bnet, Skone, Blon, Gazir, Tirpa, Mister Ego y Errecé cuentan, como nunca lo habían hecho, los entresijos de los enfrentamientos más emblemáticos de FMS España. Drama film with drama elements good quality rated content niche independent content television series episodic show series entertainment content Español language content language 4 entertainment spanish latino hispanic content"
5427,Trueno: Atrevido a soñar S1,"Episode 1 : Por primera vez Trueno y su crew visitan España para presentar en directo su disco 'ATREVIDO'. 'Trueno: Atrevido a soñar' te mostrará la exitosa gira desde dentro y como nunca antes la habías visto, culminando con el concierto que arrasó en Madrid. Durante cuatro capítulos, tendremos la oportunidad de acompañar a Mateo desde su llegada de Buenos Aires.",Documentary,5.0,296746,0,Series/TV Show,4,Español,"Trueno: Atrevido a soñar S1 Trueno: Atrevido a soñar S1 Episode 1 : Por primera vez Trueno y su crew visitan España para presentar en directo su disco  ATREVIDO .  Trueno: Atrevido a soñar  te mostrará la exitosa gira desde dentro y como nunca antes la habías visto, culminando con el concierto que arrasó en Madrid. Durante cuatro capítulos, tendremos la oportunidad de acompañar a Mateo desde su llegada de Buenos Aires. Episode 1 : Por primera vez Trueno y su crew visitan España para presentar en directo su disco  ATREVIDO .  Trueno: Atrevido a soñar  te mostrará la exitosa gira desde dentro y como nunca antes la habías visto, culminando con el concierto que arrasó en Madrid. Durante cuatro capítulos, tendremos la oportunidad de acompañar a Mateo desde su llegada de Buenos Aires. Documentary film with documentary elements low rated content niche independent content television series episodic show series entertainment content Español language content language 4 entertainment spanish latino hispanic content"
5431,"Réplica, combate de estrellas S1 - E1","Réplica, combate de estrellas 2vs2' arranca en Playz con la élite del freestyle y celebra su tercera jornada. No te pierdas una de las competiciones más esperadas con Skone, el alma de Réplica",Drama,6.0,686496,0,Series/TV Show,4,Español,"Réplica, combate de estrellas S1 - E1 Réplica, combate de estrellas S1 - E1 Réplica, combate de estrellas 2vs2  arranca en Playz con la élite del freestyle y celebra su tercera jornada. No te pierdas una de las competiciones más esperadas con Skone, el alma de Réplica Réplica, combate de estrellas 2vs2  arranca en Playz con la élite del freestyle y celebra su tercera jornada. No te pierdas una de las competiciones más esperadas con Skone, el alma de Réplica elements of action Drama film with drama elements average rated content niche independent content television series episodic show series entertainment content Español language content language 4 entertainment spanish latino hispanic content"
5432,"Réplica, combate de estrellas S1 - E2","Réplica, combate de estrellas 2vs2' arranca en Playz con la élite del freestyle y celebra su tercera jornada. No te pierdas una de las competiciones más esperadas con Skone, el alma de Réplica",Drama,6.0,385004,0,Series/TV Show,4,Español,"Réplica, combate de estrellas S1 - E2 Réplica, combate de estrellas S1 - E2 Réplica, combate de estrellas 2vs2  arranca en Playz con la élite del freestyle y celebra su tercera jornada. No te pierdas una de las competiciones más esperadas con Skone, el alma de Réplica Réplica, combate de estrellas 2vs2  arranca en Playz con la élite del freestyle y celebra su tercera jornada. No te pierdas una de las competiciones más esperadas con Skone, el alma de Réplica elements of action Drama film with drama elements average rated content niche independent content television series episodic show series entertainment content Español language content language 4 entertainment spanish latino hispanic content"
5433,"Réplica, combate de estrellas S1 - E3","Réplica, combate de estrellas 2vs2' arranca en Playz con la élite del freestyle y celebra su tercera jornada. No te pierdas una de las competiciones más esperadas con Skone, el alma de Réplica",Drama,6.0,315547,0,Series/TV Show,4,Español,"Réplica, combate de estrellas S1 - E3 Réplica, combate de estrellas S1 - E3 Réplica, combate de estrellas 2vs2  arranca en Playz con la élite del freestyle y celebra su tercera jornada. No te pierdas una de las competiciones más esperadas con Skone, el alma de Réplica Réplica, combate de estrellas 2vs2  arranca en Playz con la élite del freestyle y celebra su tercera jornada. No te pierdas una de las competiciones más esperadas con Skone, el alma de Réplica elements of action Drama film with drama elements average rated content niche independent content television series episodic show series entertainment content Español language content language 4 entertainment spanish latino hispanic content"
5434,"Réplica, combate de estrellas S1 - E4","Réplica, combate de estrellas 2vs2' arranca en Playz con la élite del freestyle y celebra su tercera jornada. No te pierdas una de las competiciones más esperadas con Skone, el alma de Réplica",Drama,6.0,278796,0,Series/TV Show,4,Español,"Réplica, combate de estrellas S1 - E4 Réplica, combate de estrellas S1 - E4 Réplica, combate de estrellas 2vs2  arranca en Playz con la élite del freestyle y celebra su tercera jornada. No te pierdas una de las competiciones más esperadas con Skone, el alma de Réplica Réplica, combate de estrellas 2vs2  arranca en Playz con la élite del freestyle y celebra su tercera jornada. No te pierdas una de las competiciones más esperadas con Skone, el alma de Réplica elements of action Drama film with drama elements average rated content niche independent content television series episodic show series entertainment content Español language content language 4 entertainment spanish latino hispanic content"
