id,title,description,genres,imdb_rating,views,ismovie,media_type_name,lang_id,language_name,enhanced_text
6448,Reina de corazones,"Episode 1- Reina pierde la memoria tras un accidente y lucha por descubrir su identidad. Mientras tanto, su amante Nicolás piensa que Reina y su marido son los responsables de su encarcelamiento y busca venganza.",Drama,7.7,3188316,0,Series/TV Show,4,Español,"Reina de corazones Reina de corazones Episode 1- Reina pierde la memoria tras un accidente y lucha por descubrir su identidad. Mientras tanto, su amante Nicolás piensa que Reina y su marido son los responsables de su encarcelamiento y busca venganza. Episode 1- Reina pierde la memoria tras un accidente y lucha por descubrir su identidad. Mientras tanto, su amante Nicolás piensa que Reina y su marido son los responsables de su encarcelamiento y busca venganza. elements of family Drama film with drama elements very good well received content moderately popular content television series episodic show series entertainment content Español language content language 4 entertainment spanish latino hispanic content"
6449,Bajo el mismo cielo,"Episode 1- Carlos Martinezis es un viudo que tiene tres hijos, uno de los cuales es un delincuente. Un día conoce a una joven con pasado criminal y se enamoran.",Drama,8.0,2103486,0,Series/TV Show,4,Español,"Bajo el mismo cielo Bajo el mismo cielo Episode 1- Carlos Martinezis es un viudo que tiene tres hijos, uno de los cuales es un delincuente. Un día conoce a una joven con pasado criminal y se enamoran. Episode 1- Carlos Martinezis es un viudo que tiene tres hijos, uno de los cuales es un delincuente. Un día conoce a una joven con pasado criminal y se enamoran. Drama film with drama elements excellent highly rated content moderately popular content television series episodic show series entertainment content Español language content language 4 entertainment spanish latino hispanic content"
6494,La Patrona,"Episode 1: Gabriela Suárez, minera, se enamora de Alejandro, el hijo de Antonia Guerra, una mujer rica y ambiciosa y así inicia su viaje de penurias y adversidades.",Drama,7.5,10722420,0,Series/TV Show,4,Español,"La Patrona La Patrona Episode 1: Gabriela Suárez, minera, se enamora de Alejandro, el hijo de Antonia Guerra, una mujer rica y ambiciosa y así inicia su viaje de penurias y adversidades. Episode 1: Gabriela Suárez, minera, se enamora de Alejandro, el hijo de Antonia Guerra, una mujer rica y ambiciosa y así inicia su viaje de penurias y adversidades. Drama film with drama elements very good well received content popular well known content television series episodic show series entertainment content Español language content language 4 entertainment spanish latino hispanic content regional blockbuster crossover potential"
6495,La impostora,"Episode 1: Cuando su padre pierde su trabajo y sufre un accidente, Blanca acepta la oferta de un hombre rico de hacerse pasar por un rico inversor interesado en la despiadada Raquel Altamira para encontrar a su hijo desaparecido.",Romance,7.8,2662282,0,Series/TV Show,4,Español,"La impostora La impostora Episode 1: Cuando su padre pierde su trabajo y sufre un accidente, Blanca acepta la oferta de un hombre rico de hacerse pasar por un rico inversor interesado en la despiadada Raquel Altamira para encontrar a su hijo desaparecido. Episode 1: Cuando su padre pierde su trabajo y sufre un accidente, Blanca acepta la oferta de un hombre rico de hacerse pasar por un rico inversor interesado en la despiadada Raquel Altamira para encontrar a su hijo desaparecido. Romance film with romance elements very good well received content moderately popular content television series episodic show series entertainment content Español language content language 4 entertainment spanish latino hispanic content"
6496,Eva la Trailera,"Episode 1: Una mujer exitosa está cansada de la naturaleza de su marido porque es una persona infiel. Ella decide dejarlo. Más tarde, conoce a otro hombre que cambia su vida.",Romance,7.4,460857,0,Series/TV Show,4,Español,"Eva la Trailera Eva la Trailera Episode 1: Una mujer exitosa está cansada de la naturaleza de su marido porque es una persona infiel. Ella decide dejarlo. Más tarde, conoce a otro hombre que cambia su vida. Episode 1: Una mujer exitosa está cansada de la naturaleza de su marido porque es una persona infiel. Ella decide dejarlo. Más tarde, conoce a otro hombre que cambia su vida. elements of family Romance film with romance elements good quality rated content niche independent content television series episodic show series entertainment content Español language content language 4 entertainment spanish latino hispanic content"
6497,Rosa diamante,"Episode 1: Cuando era niña, Rosa fue abandonada por su madre en un internado junto con dieciocho diamantes rosas para cubrir sus gastos. Rosa crece allí y encuentra en Eva una amiga íntima.",Drama,7.8,523869,0,Series/TV Show,4,Español,"Rosa diamante Rosa diamante Episode 1: Cuando era niña, Rosa fue abandonada por su madre en un internado junto con dieciocho diamantes rosas para cubrir sus gastos. Rosa crece allí y encuentra en Eva una amiga íntima. Episode 1: Cuando era niña, Rosa fue abandonada por su madre en un internado junto con dieciocho diamantes rosas para cubrir sus gastos. Rosa crece allí y encuentra en Eva una amiga íntima. Drama film with drama elements very good well received content niche independent content television series episodic show series entertainment content Español language content language 4 entertainment spanish latino hispanic content"
6498,La Querida Del Centauro S2,Episode 1: La reclusa Yolanda acepta convertirse en la amante de un famoso narcotraficante y sacarlo de su escondite a cambio de arresto domiciliario para poder proteger a su hija.,Romance,7.3,666297,0,Series/TV Show,4,Español,La Querida Del Centauro S2 La Querida Del Centauro S2 Episode 1: La reclusa Yolanda acepta convertirse en la amante de un famoso narcotraficante y sacarlo de su escondite a cambio de arresto domiciliario para poder proteger a su hija. Episode 1: La reclusa Yolanda acepta convertirse en la amante de un famoso narcotraficante y sacarlo de su escondite a cambio de arresto domiciliario para poder proteger a su hija. Romance film with romance elements good quality rated content niche independent content television series episodic show series entertainment content Español language content language 4 entertainment spanish latino hispanic content
6573,Pasión Prohibida,"Episode 1: Bianca se propone arruinar la vida de su madre casándose con Ariel Piamonte, un distinguido millonario. Sin embargo, su plan se ve amenazado por el amor verdadero cuando se enamora del sobrino de Ariel.",Romance,8.1,3186065,0,Series/TV Show,4,Español,"Pasión Prohibida Pasión Prohibida Episode 1: Bianca se propone arruinar la vida de su madre casándose con Ariel Piamonte, un distinguido millonario. Sin embargo, su plan se ve amenazado por el amor verdadero cuando se enamora del sobrino de Ariel. Episode 1: Bianca se propone arruinar la vida de su madre casándose con Ariel Piamonte, un distinguido millonario. Sin embargo, su plan se ve amenazado por el amor verdadero cuando se enamora del sobrino de Ariel. Romance film with romance elements excellent highly rated content moderately popular content television series episodic show series entertainment content Español language content language 4 entertainment spanish latino hispanic content"
6574,Sangre De Mi Tierra,"Episode 1: Dos familias complicadas, los Castaneda y los Montiel, que se dedican al mismo negocio de cultivar uvas en su viñedo, se encuentran con varios problemas debido a su rivalidad.",Drama,7.6,2404920,0,Series/TV Show,4,Español,"Sangre De Mi Tierra Sangre De Mi Tierra Episode 1: Dos familias complicadas, los Castaneda y los Montiel, que se dedican al mismo negocio de cultivar uvas en su viñedo, se encuentran con varios problemas debido a su rivalidad. Episode 1: Dos familias complicadas, los Castaneda y los Montiel, que se dedican al mismo negocio de cultivar uvas en su viñedo, se encuentran con varios problemas debido a su rivalidad. Drama film with drama elements very good well received content moderately popular content television series episodic show series entertainment content Español language content language 4 entertainment spanish latino hispanic content"
6575,Al Otro Lado Del Muro,"Episode 1: Una historia de mundos opuestos, de brechas culturales, de maneras distintas de ver la vida, que pretende reflejar el día a día de los migrantes que intentan abrirse paso en un mundo ajeno y muchas veces hostil. Una historia que cuenta la vida de dos mujeres que llegan a vivir a Estados Unidos: Una persiguiendo un sueño y la otra huyendo de una pesadilla.",Drama,8.0,288594,0,Series/TV Show,4,Español,"Al Otro Lado Del Muro Al Otro Lado Del Muro Episode 1: Una historia de mundos opuestos, de brechas culturales, de maneras distintas de ver la vida, que pretende reflejar el día a día de los migrantes que intentan abrirse paso en un mundo ajeno y muchas veces hostil. Una historia que cuenta la vida de dos mujeres que llegan a vivir a Estados Unidos: Una persiguiendo un sueño y la otra huyendo de una pesadilla. Episode 1: Una historia de mundos opuestos, de brechas culturales, de maneras distintas de ver la vida, que pretende reflejar el día a día de los migrantes que intentan abrirse paso en un mundo ajeno y muchas veces hostil. Una historia que cuenta la vida de dos mujeres que llegan a vivir a Estados Unidos: Una persiguiendo un sueño y la otra huyendo de una pesadilla. Drama film with drama elements excellent highly rated content niche independent content television series episodic show series entertainment content Español language content language 4 entertainment spanish latino hispanic content"
6576,En Otra Piel,"Episode 1: En Otra Piel es la historia de dos mujeres completamente diferentes en edad, condición social y nivel cultural. Aunque ninguna sabe nada de la otra, ambos personajes (una mesera de un bar y una famosa concertista de piano) habrán de compartir un mismo destino trágico y sobrenatural que las unirá después de la muerte",Romance,7.9,3263251,0,Series/TV Show,4,Español,"En Otra Piel En Otra Piel Episode 1: En Otra Piel es la historia de dos mujeres completamente diferentes en edad, condición social y nivel cultural. Aunque ninguna sabe nada de la otra, ambos personajes  una mesera de un bar y una famosa concertista de piano  habrán de compartir un mismo destino trágico y sobrenatural que las unirá después de la muerte Episode 1: En Otra Piel es la historia de dos mujeres completamente diferentes en edad, condición social y nivel cultural. Aunque ninguna sabe nada de la otra, ambos personajes  una mesera de un bar y una famosa concertista de piano  habrán de compartir un mismo destino trágico y sobrenatural que las unirá después de la muerte elements of family Romance film with romance elements very good well received content moderately popular content television series episodic show series entertainment content Español language content language 4 entertainment spanish latino hispanic content"
6577,"José José, el príncipe de la canción","Episode 1: El ascenso a la fama del estimado cantante mexicano José José, sus conflictos románticos y sus luchas contra el abuso de sustancias.",Drama,7.1,1334507,0,Series/TV Show,4,Español,"José José, el príncipe de la canción José José, el príncipe de la canción Episode 1: El ascenso a la fama del estimado cantante mexicano José José, sus conflictos románticos y sus luchas contra el abuso de sustancias. Episode 1: El ascenso a la fama del estimado cantante mexicano José José, sus conflictos románticos y sus luchas contra el abuso de sustancias. elements of drama Drama film with drama elements good quality rated content moderately popular content television series episodic show series entertainment content Español language content language 4 entertainment spanish latino hispanic content"
7091,El Secreto De Feriha,"Episode 1: Feriha, una chica de una familia pobre, gana una beca para una universidad de élite cuando miente sobre su posición social. Se enamora de un playboy rico y queda atrapada en su propia red de mentiras.",Drama,5.7,25679,0,Series/TV Show,4,Español,"El Secreto De Feriha El Secreto De Feriha Episode 1: Feriha, una chica de una familia pobre, gana una beca para una universidad de élite cuando miente sobre su posición social. Se enamora de un playboy rico y queda atrapada en su propia red de mentiras. Episode 1: Feriha, una chica de una familia pobre, gana una beca para una universidad de élite cuando miente sobre su posición social. Se enamora de un playboy rico y queda atrapada en su propia red de mentiras. Drama film with drama elements low rated content niche independent content television series episodic show series entertainment content Español language content language 4 entertainment spanish latino hispanic content"
7092,La Señora Fazilet y Sus Hijas,Episode 1: La señora Fazilet y sus hijas es una serie de televisión dramática turca.,Drama,6.9,4935502,0,Series/TV Show,4,Español,La Señora Fazilet y Sus Hijas La Señora Fazilet y Sus Hijas Episode 1: La señora Fazilet y sus hijas es una serie de televisión dramática turca. Episode 1: La señora Fazilet y sus hijas es una serie de televisión dramática turca. Drama film with drama elements decent watchable content moderately popular content television series episodic show series entertainment content Español language content language 4 entertainment spanish latino hispanic content
7093,Las Bandidas,"Episode 1: Fabiola, Corina y Amparo son hijas del viudo Olegario Montoya, dueño de 'Las Bandidas'. La trama gira en torno a las historias de amor de las tres hermanas y una vieja rivalidad entre la familia de Montoya e Irazábal.","Drama, Romance",8.8,3384434,0,Series/TV Show,4,Español,"Las Bandidas Las Bandidas Episode 1: Fabiola, Corina y Amparo son hijas del viudo Olegario Montoya, dueño de  Las Bandidas . La trama gira en torno a las historias de amor de las tres hermanas y una vieja rivalidad entre la familia de Montoya e Irazábal. Episode 1: Fabiola, Corina y Amparo son hijas del viudo Olegario Montoya, dueño de  Las Bandidas . La trama gira en torno a las historias de amor de las tres hermanas y una vieja rivalidad entre la familia de Montoya e Irazábal. elements of family Drama Romance film with drama, romance elements exceptional highly acclaimed masterpiece moderately popular content television series episodic show series entertainment content Español language content language 4 entertainment spanish latino hispanic content"
7094,Rivales De Sangre,Episode 1: La trágica historia de amor de una niña kurda oriental con un hombre de la región del Mar Negro.,Drama,6.0,8164193,0,Series/TV Show,4,Español,Rivales De Sangre Rivales De Sangre Episode 1: La trágica historia de amor de una niña kurda oriental con un hombre de la región del Mar Negro. Episode 1: La trágica historia de amor de una niña kurda oriental con un hombre de la región del Mar Negro. Drama film with drama elements average rated content moderately popular content television series episodic show series entertainment content Español language content language 4 entertainment spanish latino hispanic content
7095,Selin un Amor Inolvidable,"Episode 1: El hijo adoptivo de Aziz, Kartal, se ve obligado a casarse con su hermana adoptiva para continuar con el éxito de su familia adoptiva a pesar de que se enamora de otra mujer.",Romance,5.7,167673,0,Series/TV Show,4,Español,"Selin un Amor Inolvidable Selin un Amor Inolvidable Episode 1: El hijo adoptivo de Aziz, Kartal, se ve obligado a casarse con su hermana adoptiva para continuar con el éxito de su familia adoptiva a pesar de que se enamora de otra mujer. Episode 1: El hijo adoptivo de Aziz, Kartal, se ve obligado a casarse con su hermana adoptiva para continuar con el éxito de su familia adoptiva a pesar de que se enamora de otra mujer. Romance film with romance elements low rated content niche independent content television series episodic show series entertainment content Español language content language 4 entertainment spanish latino hispanic content"
7096,Lo que callamos las mujeres,"Episode 1:  Lo que callamos las mujeres, es una serie de televisión de antología mexicana que trata sobre los problemas sociales de la sociedad mexicana.",Drama,6.5,8517,0,Series/TV Show,4,Español,"Lo que callamos las mujeres Lo que callamos las mujeres Episode 1: Lo que callamos las mujeres, es una serie de televisión de antología mexicana que trata sobre los problemas sociales de la sociedad mexicana. Episode 1: Lo que callamos las mujeres, es una serie de televisión de antología mexicana que trata sobre los problemas sociales de la sociedad mexicana. Drama film with drama elements decent watchable content niche independent content television series episodic show series entertainment content Español language content language 4 entertainment spanish latino hispanic content"
7097,Vivir a destiempo,"Episode 1: Vivir a Destiempo es una telenovela mexicana producida por Fides Velasco y Jacky Castro para Azteca. Está protagonizada por Edith González y Ramiro Fumazoni como protagonistas junto a Humberto Zurita, Andrea Noli y Wendy de los Cobos como los villanos principales.",Drama,7.2,16879,0,Series/TV Show,4,Español,"Vivir a destiempo Vivir a destiempo Episode 1: Vivir a Destiempo es una telenovela mexicana producida por Fides Velasco y Jacky Castro para Azteca. Está protagonizada por Edith González y Ramiro Fumazoni como protagonistas junto a Humberto Zurita, Andrea Noli y Wendy de los Cobos como los villanos principales. Episode 1: Vivir a Destiempo es una telenovela mexicana producida por Fides Velasco y Jacky Castro para Azteca. Está protagonizada por Edith González y Ramiro Fumazoni como protagonistas junto a Humberto Zurita, Andrea Noli y Wendy de los Cobos como los villanos principales. Drama film with drama elements good quality rated content niche independent content television series episodic show series entertainment content Español language content language 4 entertainment spanish latino hispanic content"
7099,Todo Por Amor,Episode 1: Todo por amor is a Mexican telenovela produced by Argos Comunicación for TV Azteca.,Drama,7.0,2835,0,Series/TV Show,4,Español,Todo Por Amor Todo Por Amor Episode 1: Todo por amor is a Mexican telenovela produced by Argos Comunicación for TV Azteca. Episode 1: Todo por amor is a Mexican telenovela produced by Argos Comunicación for TV Azteca. Drama film with drama elements good quality rated content niche independent content television series episodic show series entertainment content Español language content language 4 entertainment spanish latino hispanic content
7100,Quiéreme Tonto,"Episode 1: Quiéreme Tonto es una telenovela mexicana de TV Azteca, al parecer un remake de Bésame Tonto, que tiene el mismo autor. Se estrenó el 19 de abril de 2010.",Romance,6.2,7936,0,Series/TV Show,4,Español,"Quiéreme Tonto Quiéreme Tonto Episode 1: Quiéreme Tonto es una telenovela mexicana de TV Azteca, al parecer un remake de Bésame Tonto, que tiene el mismo autor. Se estrenó el 19 de abril de 2010. Episode 1: Quiéreme Tonto es una telenovela mexicana de TV Azteca, al parecer un remake de Bésame Tonto, que tiene el mismo autor. Se estrenó el 19 de abril de 2010. Romance film with romance elements average rated content niche independent content television series episodic show series entertainment content Español language content language 4 entertainment spanish latino hispanic content"
7219,Muted,"Sergio sale de prisión 6 años después de asesinar a sus padres cuando aún era menor de edad. Durante ese tiempo, Sergio no ha dicho una palabra. Ana Dussel, una joven psiquiatra, intenta descubrir toda la historia.",Thriller,5.6,886505,0,Series/TV Show,4,Español,"Muted Muted Sergio sale de prisión 6 años después de asesinar a sus padres cuando aún era menor de edad. Durante ese tiempo, Sergio no ha dicho una palabra. Ana Dussel, una joven psiquiatra, intenta descubrir toda la historia. Sergio sale de prisión 6 años después de asesinar a sus padres cuando aún era menor de edad. Durante ese tiempo, Sergio no ha dicho una palabra. Ana Dussel, una joven psiquiatra, intenta descubrir toda la historia. Thriller film with thriller elements low rated content niche independent content television series episodic show series entertainment content Español language content language 4 entertainment spanish latino hispanic content"
7245,Wrong Side of the Tracks S1,"Cuando su nieta adolescente es víctima de los traficantes de drogas que invaden su vecindario, un veterano de guerra harto toma el asunto en sus propias manos.",Drama,7.0,11949,0,Series/TV Show,4,Español,"Wrong Side of the Tracks S1 Wrong Side of the Tracks S1 Cuando su nieta adolescente es víctima de los traficantes de drogas que invaden su vecindario, un veterano de guerra harto toma el asunto en sus propias manos. Cuando su nieta adolescente es víctima de los traficantes de drogas que invaden su vecindario, un veterano de guerra harto toma el asunto en sus propias manos. elements of coming_of_age Drama film with drama elements good quality rated content niche independent content television series episodic show series entertainment content Español language content language 4 entertainment spanish latino hispanic content"
7247,Wrong Side of the Tracks S2,"Cuando su nieta adolescente es víctima de los traficantes de drogas que invaden su vecindario, un veterano de guerra harto toma el asunto en sus propias manos.",Drama,7.0,6746,0,Series/TV Show,4,Español,"Wrong Side of the Tracks S2 Wrong Side of the Tracks S2 Cuando su nieta adolescente es víctima de los traficantes de drogas que invaden su vecindario, un veterano de guerra harto toma el asunto en sus propias manos. Cuando su nieta adolescente es víctima de los traficantes de drogas que invaden su vecindario, un veterano de guerra harto toma el asunto en sus propias manos. elements of coming_of_age Drama film with drama elements good quality rated content niche independent content television series episodic show series entertainment content Español language content language 4 entertainment spanish latino hispanic content"
7253,Sky High: The Series,"Sole, una joven viuda con un hijo a su cargo, no está dispuesta a volver a la tutela de su padre Rogelio, uno de los mayores traficantes de bienes robados de Madrid. Para evitarlo, se une a la banda de ladrones de su difunto marido.",Drama,6.3,410733,0,Series/TV Show,4,Español,"Sky High: The Series Sky High: The Series Sole, una joven viuda con un hijo a su cargo, no está dispuesta a volver a la tutela de su padre Rogelio, uno de los mayores traficantes de bienes robados de Madrid. Para evitarlo, se une a la banda de ladrones de su difunto marido. Sole, una joven viuda con un hijo a su cargo, no está dispuesta a volver a la tutela de su padre Rogelio, uno de los mayores traficantes de bienes robados de Madrid. Para evitarlo, se une a la banda de ladrones de su difunto marido. Drama film with drama elements average rated content niche independent content television series episodic show series entertainment content Español language content language 4 entertainment spanish latino hispanic content"
7258,Triptych,"Aleida Trujano se entera que es una de los tres trillizos. Tras este sorprendente descubrimiento, la detective se embarca en una peligrosa búsqueda de pistas para desentrañar su misterioso pasado.",Thriller,6.3,21511,0,Series/TV Show,4,Español,"Triptych Triptych Aleida Trujano se entera que es una de los tres trillizos. Tras este sorprendente descubrimiento, la detective se embarca en una peligrosa búsqueda de pistas para desentrañar su misterioso pasado. Aleida Trujano se entera que es una de los tres trillizos. Tras este sorprendente descubrimiento, la detective se embarca en una peligrosa búsqueda de pistas para desentrañar su misterioso pasado. elements of thriller Thriller film with thriller elements average rated content niche independent content television series episodic show series entertainment content Español language content language 4 entertainment spanish latino hispanic content"
7306,Omer Sueños Robados,"Episode 1: Una Historia de un hermano, una hermana y su amor, protegiéndolos de todo mal. Cada personaje tiene un sentimiento herido. Cómo la vida les da sufrimiento y la solución misma.",Drama,4.9,2363185,0,Series/TV Show,4,Español,"Omer Sueños Robados Omer Sueños Robados Episode 1: Una Historia de un hermano, una hermana y su amor, protegiéndolos de todo mal. Cada personaje tiene un sentimiento herido. Cómo la vida les da sufrimiento y la solución misma. Episode 1: Una Historia de un hermano, una hermana y su amor, protegiéndolos de todo mal. Cada personaje tiene un sentimiento herido. Cómo la vida les da sufrimiento y la solución misma. elements of family Drama film with drama elements low rated content moderately popular content television series episodic show series entertainment content Español language content language 4 entertainment spanish latino hispanic content"
